{
  "status": "ACTIVE",
  "autoApprove": true,
  "limitsByApi": [
    {
      "apiId": 3,
      "limits": [
        {
            "visible": true,
            "maximumRequests": 5,
            "timePeriodInMilliseconds": 1
        }
      ]
    }
  ],
  "name": "tierName",
  "description": "tier description"
}
